{
  "case_id": "C-001",
  "schema_version": "1.0",
  "description": "웹셸 업로드를 통한 초기 침투 후 로컬 특권 계정 생성으로 지속성 확보",
  "authored_by": "human",
  "target_os": "windows",
  "expected_techniques": ["T1505.003", "T1136.001"],
  "expected_time_range": {
    "start": "2026-07-20T00:00:00Z",
    "end": "2026-07-20T23:59:59Z"
  },
  "required_artifacts": ["$MFT", "evtx:Security"],
  "required_refs": [
    { "ref": "MFT#12345", "why": "웹셸 shell.aspx 생성 및 타임스탬프 조작" },
    { "ref": "EVTX-SEC#40912", "why": "svc_backup 계정 생성 (4720)" },
    { "ref": "EVTX-SEC#40915", "why": "svc_backup의 Administrators 그룹 추가 (4732)" }
  ],
  "acceptable_artifacts": ["$UsnJrnl", "evtx:System"],
  "notes": "acceptable_artifacts는 선별되어도 오탐으로 간주하지 않는 항목. 재현율 계산의 분모는 required_artifacts."
}
